{
  "schema_version": "1.0.0",
  "subsystem": "S1_Visual_Perception",
  "created_at": "2026-09-01T20:45:45.327929+00:00",
  "video_source": "benchmarks/dataset/video-1005/video.mp4",
  "total_observations": 239,
  "keyframe_count": 27,
  "keyframe_density": 0.113,
  "temporal_information": {
    "time_unit": "seconds",
    "time_reference": "relative_capture_time",
    "is_monotonic": true,
    "processing_time_seconds": 53.1581,
    "start_time_offset": 0.0,
    "end_time_offset": null,
    "frame_interval_seconds": 0.016683,
    "video_duration_seconds": 238.355
  },
  "camera": {
    "width": 1920,
    "height": 1080,
    "intrinsics": null,
    "distortion": null,
    "is_calibrated": false
  },
  "quality_summary": {
    "GOOD": 239,
    "BLURRY": 0,
    "OVEREXPOSED": 0,
    "UNDEREXPOSED": 0,
    "LOW_FEATURE": 0,
    "CORRUPTED": 0
  },
  "observations": [
    {
      "observation_id": "frame_000001",
      "timestamp": 0.0,
      "image": "frames/frame_000001.jpg",
      "camera": {
        "width": 1920,
        "height": 1080,
        "intrinsics": null,
        "distortion": null
      },
      "quality": {
        "status": "GOOD",
        "blur_score": 1051.48,
        "quality_score": 98.36,
        "flags": []
      },
      "keyframe": true
    },
    {
      "observation_id": "frame_000002",
      "timestamp": 1.001,
      "image": "frames/frame_000002.jpg",
      "camera": {
        "width": 1920,
        "height": 1080,
        "intrinsics": null,
        "distortion": null
      },
      "quality": {
        "status": "GOOD",
        "blur_score": 1037.152,
        "quality_score": 98.44,
        "flags": []
      },
      "keyframe": false
    },
    {
      "observation_id": "frame_000003",
      "timestamp": 2.002,
      "image": "frames/frame_000003.jpg",
      "camera": {
        "width": 1920,
        "height": 1080,
        "intrinsics": null,
        "distortion": null
      },
      "quality": {
        "status": "GOOD",
        "blur_score": 976.894,
        "quality_score": 98.48,
        "flags": []
      },
      "keyframe": false
    },
    {
      "observation_id": "frame_000004",
      "timestamp": 3.003,
      "image": "frames/frame_000004.jpg",
      "camera": {
        "width": 1920,
        "height": 1080,
        "intrinsics": null,
        "distortion": null
      },
      "quality": {
        "status": "GOOD",
        "blur_score": 980.198,
        "quality_score": 98.49,
        "flags": []
      },
      "keyframe": false
    },
    {
      "observation_id": "frame_000005",
      "timestamp": 4.004,
      "image": "frames/frame_000005.jpg",
      "camera": {
        "width": 1920,
        "height": 1080,
        "intrinsics": null,
        "distortion": null
      },
      "quality": {
        "status": "GOOD",
        "blur_score": 963.811,
        "quality_score": 98.47,
        "flags": []
      },
      "keyframe": false
    },
    {
      "observation_id": "frame_000006",
      "timestamp": 5.005,
      "image": "frames/frame_000006.jpg",
      "camera": {
        "width": 1920,
        "height": 1080,
        "intrinsics": null,
        "distortion": null
      },
      "quality": {
        "status": "GOOD",
        "blur_score": 587.118,
        "quality_score": 98.6,
        "flags": []
      },
      "keyframe": false
    },
    {
      "observation_id": "frame_000007",
      "timestamp": 6.006,
      "image": "frames/frame_000007.jpg",
      "camera": {
        "width": 1920,
        "height": 1080,
        "intrinsics": null,
        "distortion": null
      },
      "quality": {
        "status": "GOOD",
        "blur_score": 799.461,
        "quality_score": 98.6,
        "flags": []
      },
      "keyframe": false
    },
    {
      "observation_id": "frame_000008",
      "timestamp": 7.007,
      "image": "frames/frame_000008.jpg",
      "camera": {
        "width": 1920,
        "height": 1080,
        "intrinsics": null,
        "distortion": null
      },
      "quality": {
        "status": "GOOD",
        "blur_score": 610.529,
        "quality_score": 98.58,
        "flags": []
      },
      "keyframe": false
    },
    {
      "observation_id": "frame_000009",
      "timestamp": 8.008,
      "image": "frames/frame_000009.jpg",
      "camera": {
        "width": 1920,
        "height": 1080,
        "intrinsics": null,
        "distortion": null
      },
      "quality": {
        "status": "GOOD",
        "blur_score": 549.83,
        "quality_score": 98.84,
        "flags": []
      },
      "keyframe": false
    },
    {
      "observation_id": "frame_000010",
      "timestamp": 9.009,
      "image": "frames/frame_000010.jpg",
      "camera": {
        "width": 1920,
        "height": 1080,
        "intrinsics": null,
        "distortion": null
      },
      "quality": {
        "status": "GOOD",
        "blur_score": 787.331,
        "quality_score": 99.41,
        "flags": []
      },
      "keyframe": false
    },
    {
      "observation_id": "frame_000011",
      "timestamp": 10.01,
      "image": "frames/frame_000011.jpg",
      "camera": {
        "width": 1920,
        "height": 1080,
        "intrinsics": null,
        "distortion": null
      },
      "quality": {
        "status": "GOOD",
        "blur_score": 746.035,
        "quality_score": 99.72,
        "flags": []
      },
      "keyframe": false
    },
    {
      "observation_id": "frame_000012",
      "timestamp": 11.011,
      "image": "frames/frame_000012.jpg",
      "camera": {
        "width": 1920,
        "height": 1080,
        "intrinsics": null,
        "distortion": null
      },
      "quality": {
        "status": "GOOD",
        "blur_score": 626.875,
        "quality_score": 99.18,
        "flags": []
      },
      "keyframe": false
    },
    {
      "observation_id": "frame_000013",
      "timestamp": 12.012,
      "image": "frames/frame_000013.jpg",
      "camera": {
        "width": 1920,
        "height": 1080,
        "intrinsics": null,
        "distortion": null
      },
      "quality": {
        "status": "GOOD",
        "blur_score": 541.933,
        "quality_score": 98.86,
        "flags": []
      },
      "keyframe": true
    },
    {
      "observation_id": "frame_000014",
      "timestamp": 13.013,
      "image": "frames/frame_000014.jpg",
      "camera": {
        "width": 1920,
        "height": 1080,
        "intrinsics": null,
        "distortion": null
      },
      "quality": {
        "status": "GOOD",
        "blur_score": 462.197,
        "quality_score": 99.66,
        "flags": []
      },
      "keyframe": false
    },
    {
      "observation_id": "frame_000015",
      "timestamp": 14.014,
      "image": "frames/frame_000015.jpg",
      "camera": {
        "width": 1920,
        "height": 1080,
        "intrinsics": null,
        "distortion": null
      },
      "quality": {
        "status": "GOOD",
        "blur_score": 439.687,
        "quality_score": 99.66,
        "flags": []
      },
      "keyframe": false
    },
    {
      "observation_id": "frame_000016",
      "timestamp": 15.015,
      "image": "frames/frame_000016.jpg",
      "camera": {
        "width": 1920,
        "height": 1080,
        "intrinsics": null,
        "distortion": null
      },
      "quality": {
        "status": "GOOD",
        "blur_score": 424.054,
        "quality_score": 99.31,
        "flags": []
      },
      "keyframe": false
    },
    {
      "observation_id": "frame_000017",
      "timestamp": 16.016,
      "image": "frames/frame_000017.jpg",
      "camera": {
        "width": 1920,
        "height": 1080,
        "intrinsics": null,
        "distortion": null
      },
      "quality": {
        "status": "GOOD",
        "blur_score": 413.925,
        "quality_score": 99.22,
        "flags": []
      },
      "keyframe": false
    },
    {
      "observation_id": "frame_000018",
      "timestamp": 17.017,
      "image": "frames/frame_000018.jpg",
      "camera": {
        "width": 1920,
        "height": 1080,
        "intrinsics": null,
        "distortion": null
      },
      "quality": {
        "status": "GOOD",
        "blur_score": 469.319,
        "quality_score": 98.98,
        "flags": []
      },
      "keyframe": true
    },
    {
      "observation_id": "frame_000019",
      "timestamp": 18.018,
      "image": "frames/frame_000019.jpg",
      "camera": {
        "width": 1920,
        "height": 1080,
        "intrinsics": null,
        "distortion": null
      },
      "quality": {
        "status": "GOOD",
        "blur_score": 484.475,
        "quality_score": 98.84,
        "flags": []
      },
      "keyframe": false
    },
    {
      "observation_id": "frame_000020",
      "timestamp": 19.019,
      "image": "frames/frame_000020.jpg",
      "camera": {
        "width": 1920,
        "height": 1080,
        "intrinsics": null,
        "distortion": null
      },
      "quality": {
        "status": "GOOD",
        "blur_score": 474.701,
        "quality_score": 98.68,
        "flags": []
      },
      "keyframe": false
    },
    {
      "observation_id": "frame_000021",
      "timestamp": 20.02,
      "image": "frames/frame_000021.jpg",
      "camera": {
        "width": 1920,
        "height": 1080,
        "intrinsics": null,
        "distortion": null
      },
      "quality": {
        "status": "GOOD",
        "blur_score": 431.081,
        "quality_score": 98.49,
        "flags": []
      },
      "keyframe": false
    },
    {
      "observation_id": "frame_000022",
      "timestamp": 21.021,
      "image": "frames/frame_000022.jpg",
      "camera": {
        "width": 1920,
        "height": 1080,
        "intrinsics": null,
        "distortion": null
      },
      "quality": {
        "status": "GOOD",
        "blur_score": 388.462,
        "quality_score": 98.36,
        "flags": []
      },
      "keyframe": false
    },
    {
      "observation_id": "frame_000023",
      "timestamp": 22.022,